id,name,text,trans
3006004040010,結華,たっだいまー\nいやー、今日もみんな、がんばったね！,我回来啦～\n哎呀，今天大家也都很努力呢！
3006004040020,恋鐘,今日もバッチリたい！\n次の仕事はいつね！？,今天也是完美的一天！\n下一份工作是什么时候啊！？
3006004040030,咲耶,この後は特に仕事は入っていなかったんじゃないかな,接下来好像没有特别的工作安排吧
3006004040040,摩美々,みんな元気だねー\n私は、疲れたしもう休みたいー,大家真有精神啊～\n我已经累了，想休息了～
3006004040050,恋鐘,疲れとる暇はなかよ～！\nあっ！　いまからレッスンでもせんね！？,没到累的时候呢～！\n啊！现在开始课程练习怎么样！？
3006004040060,結華,ダメダメ。休む時はキチンと休む！\nこれ、アイドルの基本！,不行不行。该休息的时候得好好休息！\n这可是，身为偶像的基本！
3006004040070,恋鐘,んー、確かにそういわれればそうたい,嗯～这么说的话确实也有道理呢
3006004040080,摩美々,ほーらぁ\nだから休んじゃおうよー,看吧～\n所以我们就休息吧～
3006004040090,恋鐘,それならうちも休むっ！,那咱也休息！
3006004040100,霧子,……ふふ\nみんな……お疲れ様……,……呵呵\n大家……辛苦了……
3006004040110,咲耶,……みんな、ちょっといいかな？\nこれを見てほしいんだ,……大家，能不能稍微听我说一下？\n想让你们看看这个
3006004040120,霧子,ネイルの……専門誌……？,美甲的……专题杂志……？
3006004040130,結華,んん？\nもしや、さくやんもネイルにハマりだした感じ？,嗯？\n难道说，咲耶耶也开始迷上美甲了？
3006004040140,咲耶,ああ。ちょっと興味が湧いてね,是啊。稍微有点感兴趣
3006004040150,咲耶,ほかにはどんなデザインがあるのか知りたくなって\n１人で調べてみたんだ,因为想知道还有什么样的设计\n所以我一个人看了一下
3006004040160,結華,へぇー！　すごいじゃん！　見せて見せてー！,哇～太棒了！让我看看～
3006004040170,恋鐘,あ、このページのネイルに\nうちの名前の付箋があると！,啊，这一页的美甲上\n有贴着咱名字的便签哦！
3006004040180,摩美々,あー、私の名前もあるー,啊，我的名字也在这儿～
3006004040190,霧子,わぁ……！\nでも、あの、咲耶さん……これって……？,哇……！\n但是，咲耶……这是……？
3006004040200,咲耶,まだプロデューサーには相談していないんだけれど\n衣装を着るとき、ネイルをするのもいいかなと思ってね,虽然还没有和制作人商量\n但我在想，穿着演出服的时候顺便做一下美甲也不错
3006004040210,恋鐘,うんうん！　それ、むっちゃいい！,嗯嗯！那样的话，一定真的很棒！
3006004040220,咲耶,それで、みんなの個性を\nネイルで表現したらどうだろうかと思って,所以，我在想\n如果用美甲来展现出大家的个性就好了
3006004040230,咲耶,せっかくなら、\nみんなのいいところを表したデザインにしたいと思ってね,有机会的话，\n我想要设计出能展现大家个性的指甲油
3006004040240,咲耶,たとえばこのネイルなら\n摩美々の個性的で魅力あるセンスを表現できると思うんだ,比如这款指甲油\n就感觉可以表现摩美美独特的有魅力
3006004040250,摩美々,ふーん。いい線、いってるっていうかぁ\n私のこと、ちゃんと見てるんだぁ……,嗯嗯。挺不错的选择呢，\n看来，你真的很懂我呢……
3006004040260,咲耶,この明るく、見るものを元気づけるようなネイルは恋鐘\n眩しいほど前向きなキミにピッタリだと思わないかい？,这款明亮的，让人看了元气满满的指甲油是恋钟\n完美契合站在台前绚烂夺目的你不是吗吗？
3006004040270,恋鐘,キラッキラでかわいか～\nうちが思ってるアイドルのイメージどおりばい！,闪闪发光的好可爱～\n完全就是咱想要的偶像形象呢！
3006004040280,咲耶,結華はこれかな。ひとつひとつのデザインは異なるが\n全体で見ると調和がとれていてバランスがいい,结华的话适合这款。每一片的设计都完全不一样\n但整体来看协调且平衡得很好
3006004040290,結華,なになにー？　ムードメーカーってこと？\nそんなに褒められると三峰照れちゃうなぁ,什么什么？是在说我是气氛活跃的专家吗？\n被这么夸奖夸得三峰峰都要害羞了
3006004040300,咲耶,フフ、結華のそういうところに私も助けられているんだ\nこれからも頼りにしているよ,呵呵，结华你的这种个性也帮助了我很多\n以后也请多多依赖你哟
3006004040310,咲耶,そして、柔らかな色合いで指に寄り添うようなこのネイル\n目立つものではないが、どんな衣装にも違和感なく馴染む,还有，这款色调柔和，仿佛依偎在指甲上的指甲油\n虽不显眼，但无论搭配什么衣服都不会有违和感
3006004040320,咲耶,他人を思いやり\n痛みを理解できる優しい霧子にこそふさわしいと思うんだ,为他人着想\n能理解痛苦的温柔雾子最适合这款了
3006004040330,霧子,そ、そんな……\nでも、わたしも好きです……このデザイン……,那、那个……\n但是，我也很喜欢这个设计……
3006004040340,霧子,でも、この雑誌……咲耶さんの名前、見当たりませんね？,但是，这本杂志上……没有找到，咲耶的名字呢？
3006004040350,咲耶,あ……,啊……
3006004040360,咲耶,しまった……。みんなのことばかりで\n自分のことは忘れていたようだ……,糟了……一直在挑大家的\n我把自己的给忘了……
3006004040370,恋鐘,じゃあ、うちらで咲耶にピッタリなネイル探しちゃるけん！,那，我们就来帮咲耶找适合你的美甲吧！
3006004040380,恋鐘,それで、衣装にこういうネイル取り入れよーって\nプロデューサーにアピールするばい！,然后，我们就向制作人提议\n穿演出服的时候加入这样的美甲！
3006004040390,咲耶,いいのかい？,真的可以吗？
3006004040400,結華,三峰達の分は、さくやんが頑張って\n考えてくれたしね。さぁって、何がいいかなー,三峰们的部分，是咲耶耶那么努力\n考虑出来的。那么，选哪个好呢～
3006004040410,摩美々,私、咲耶のネイルはこれがいいと思うー\n姫々しいの似合うって、この間分かったからぁ,我觉得咲耶适合这款美甲～\n因为上次就发现很适合公主风呢
3006004040420,霧子,わ、わたしは……このシンプルなのがいいと思う\n咲耶さんの……洗練された雰囲気にピッタリ,我、我觉得……这个简洁的就很好\n非常适合咲耶……精致的气质
3006004040430,結華,三峰はこれとかいいと思うよ！,三峰峰觉得这个也不错哦！
3006004040440,恋鐘,うちはこっちのやつがいいと思うばい！,咱觉得这个最好的！
3006004040450,咲耶,（フフ。やっぱりこのメンバーでいるのはとても楽しいな）,（呵呵。果然和这些队友们在一起就会非常开心）
3006004040460,咲耶,みんな、ありがとう\nどんなネイルになるか、とても楽しみだよ,大家，真的非常感谢\n最后会做一个怎么样的美甲呢，我非常期待哦
info,produce_events/300600404.json,,
译者,武田,,