id,name,text,trans
1014001020010,甘奈,わぁーすごい\nこの子たち、みーんなアイドルなんだぁ,哇——好厉害\n在这里的大家都是偶像呢
0000000000000,プロデューサー,甘奈と似たような立場の、新人アイドル達だな\n今日は新人ユニットが何組も出るライブイベントなんだ,和甘奈一样，都是些新人偶像\n今天的演唱会，有几组新人偶像组合会出场
0000000000000,プロデューサー,とはいえ\n『W.I.N.G.』ほどじゃないから、緊張するなよ,虽说如此\n规模没有“W.I.N.G.”这么大，不用紧张
1014001020020,甘奈,『W.I.N.G.』って……？,“W.I.N.G.”是……？
1014001020021,甘奈,ああ！　それって、あのすごいやつのことだよね！,啊！就是那个很厉害的演唱会吧！
1014001020030,甘奈,ちゃーんと、わかってるよ！,甘奈知道的哦！
0000000000000,プロデューサー,（良かった、緊張してないようで……\n甘奈、リラックスできているみたいだな）,“太好了，看来没有在紧张……\n甘奈，好像放松下来了呢”
0000000000000,スタッフ,次、大崎甘奈さん、お願いしまーす！,接下来，大崎甘奈小姐，有请！
0000000000000,プロデューサー,ほら甘奈、出番だ\n元気よく行ってこい！,甘奈，该出场了\n打起精神，去吧！
1014001020040,甘奈,うん！　プロデューサーさん、行ってくるね！,嗯！制作人，甘奈过去了！
1014001020050,甘奈,みんなー！　今日は、よっろしくー！\n楽しんでいこうねー！,大家——！今天请多关照——！\n好好享受这场演唱会吧——！
1014001020060,甘奈,えへ、ありがとー！\n甘奈もみんなのこと、大好きだよー！,诶嘿嘿，谢谢——！\n甘奈也最喜欢大家了哦——！
0000000000000,プロデューサー,（甘奈、堂々としているな\nうん、お客さんにちゃんとレスもできている）,（甘奈，表现的落落大方呢\n嗯，也有好好地回应了观众们）
0000000000000,プロデューサー,（デビューしたてで、\nイベントにもまだ不慣れなはずなのに、すごいぞ）,（刚出道不久，\n按理说应该还不太习惯这种活动的，真厉害啊）
1014001020070,甘奈,プロデューサーさん、たっだいまー！,制作人，甘奈回来了！
0000000000000,プロデューサー,甘奈、お疲れ様！\n良かったぞ！,甘奈，辛苦了！\n表现的很好哦！
0000000000000,プロデューサー,これからがすごく楽しみだ！\nこの調子でがんばれば『W.I.N.G.』も夢じゃない！,真是期待甘奈今后的发展呢！\n以这个势头努力下去的话，“W.I.N.G.”也不会是梦！
1014001020080,甘奈,えへへ、ありがと！\nステージ、すっごく楽しかったー！,诶嘿嘿，谢谢！\n这次演唱会非常愉快！
1014001020090,甘奈,お客さんもめっちゃ応援してくれたんだー\nうれしかったぁ,观众们很热情地给甘奈加油\n真的很开心
0000000000000,プロデューサー,そうか、それなら良かった,是吗，那真是太好了
0000000000000,プロデューサー,ステージが楽しめるっていうのは、\nアイドルとして大事なことだからな,能在舞台上感受到快乐，\n对偶像来说是一件很重要的事情
1014001020100,甘奈,えへへ、そうなんだー,诶嘿嘿，是这样啊
1014001020110,甘奈,アイドルとして大事なこと、かぁ\nう～ん……,对偶像来说重要的事情吗\n嗯……
0000000000000,プロデューサー,どうした？,怎么了？
1014001020120,甘奈,ね、プロデューサーさん\n甘奈、どうかな？,那个，制作人你觉得\n甘奈，怎么样呢？
0000000000000,プロデューサー,（……どうかなって、どういうことだろう\nさっき褒めたけど、それじゃだめだったのか……？）,（……怎么样，是指什么\n刚才夸了她一番，那样不行吗……？）
0000000000000,プロデューサー,……すまん、どういう意味だ？,……抱歉，你问的是什么？
1014001020130,甘奈,えっと……甘奈、アイドルできそうかな？,那个……甘奈，能做好偶像吗？
select,,甘奈なら、\nきっとできるよ,甘奈的话，\n肯定能行的
select,,充分スタート地点に\n立てている,已经稳稳地\n站在起跑线上了
select,,何か不安に思うことが\nあるのか,有什么\n让你感到不安的事吗
0000000000000,プロデューサー,ルックスとダンス、それに歌,形象与舞蹈，还有唱功
0000000000000,プロデューサー,新人アイドルとは思えないほどのものを、\n甘奈はちゃんと持っている,甘奈有着不像是一个新人偶像会有的实力
1014001020140,甘奈,プロデューサーさんってば、褒めすぎだよ～\nえへ、でも嬉しい。ありがとっ！,制作人真是的，夸过头啦～\n诶嘿嘿，不过甘奈很开心。谢谢！
0000000000000,プロデューサー,事実を言ったまでだ,我只是在说事实而已
0000000000000,プロデューサー,だけど、急にどうしたんだ？\nステージで何かあったのか？,不过，突然是怎么了？\n在舞台上发生了什么事吗？
1014001020150,甘奈,えっ……？\nうーん……特別、何かあったってわけじゃないよー？,诶……？\n不是……没有什么哦
1014001020160,甘奈,ただ、他の子たちの頑張りを見てると\n本当にやっていけるのかなって心配しちゃって,只是，看见其他的偶像努力的样子\n在担心自己真的能行吗
1014001020170,甘奈,でも、プロデューサーさんが大丈夫って言うなら\n安心したかも！　うん、ありがとっ！,不过，制作人说了没问题\n甘奈就放心了！嗯，谢谢！
0000000000000,プロデューサー,あぁ、甘奈はいいアイドルになれる\n自信を持っていこう！,嗯，甘奈能成为出色的偶像的\n相信自己吧！
1014001020180,甘奈,ホント？,真的吗？
0000000000000,プロデューサー,あぁ、本当だ\n俺は今日のステージを見て、安心したよ,嗯，真的\n看了你今天的表现，我放心了
0000000000000,プロデューサー,甘奈は問題なくアイドルとしてやっていけそうだし\n何も心配ないなって,甘奈能作为一个偶像走下去，没有什么需要担心\n我是这么想的
1014001020190,甘奈,プロデューサーさん、そんなふうに思ってくれてたんだ\nでもね、甘奈は……,制作人，是这么想的啊\n可是，甘奈……
0000000000000,プロデューサー,大丈夫だ,没事的
1014001020200,甘奈,え？,诶？
0000000000000,プロデューサー,甘奈には、甜花がいるじゃないか,甘奈不是有甜花在吗
1014001020210,甘奈,あ、そっか\n甘奈には甜花ちゃんが……,啊，这样啊\n甘奈有甜花在……
0000000000000,プロデューサー,それに千雪だっているしな\nそれでも、アイドルやっていくのは不安に思うか？,还有千雪在呢\n即便如此，做偶像还是会感到不安吗？
1014001020220,甘奈,……ううん、思わないかも,……没有，不会呢
1014001020230,甘奈,そうだよね、\nみんなと一緒に頑張っていければ大丈夫だよね！,说的没错，\n能和大家一起加油的话，肯定没问题的！
0000000000000,プロデューサー,あぁ、もちろんだ！\nこれから頑張っていこうな、甘奈！,嗯，当然了！\n今后好好努力吧，甘奈！
0000000000000,プロデューサー,さっきのステージ、\n立派にこなせていたじゃないか,刚刚在舞台上，\n你表现的不是很好吗
1014001020240,甘奈,不安っていうほどじゃないんだけどねー,虽然还没有到不安的程度
1014001020250,甘奈,周りのアイドルたちのすっごいやる気を見てたら……\n甘奈、それについていけるのかなって,看见周围的偶像们那干劲满满的样子……\n有些担心，自己能不能跟上她们的步伐
0000000000000,プロデューサー,（甘奈……そんなことを思っていたのか……\nこれは、もっとちゃんと話を聞いた方がいいな）,（甘奈……在想这种事吗……\n最好跟她好好谈谈这件事啊）
0000000000000,プロデューサー,甘奈\nこの後、事務所に行かないか？,甘奈\n演唱会结束后，能去一下事务所吗？
1014001020260,甘奈,え？　なんで？,诶？为什么？
0000000000000,プロデューサー,立ち話じゃなくて、もっとしっかり相談をしよう\n甘奈には、大事なことだろう？,关于这件事，让我们好好谈一谈吧\n这对甘奈来说，是件很重要的事情吧？
1014001020270,甘奈,プロデューサーさん……\n甘奈のこと、ちゃんと考えてくれてるんだね,制作人……\n有好好考虑着甘奈的事呢
0000000000000,プロデューサー,当たり前じゃないか\n俺は甘奈のプロデューサーなんだからな,这不是理所当然的吗\n因为我是甘奈的制作人啊
1014001020280,甘奈,プロデューサーさん、ありがとっ！,制作人，谢谢你！
1014001020290,甘奈,じゃあ、とことん話聞いてもらうねっ,那么，制作人要认真听甘奈说哦
info,produce_events/101400102.json,,
译者,Rosineae,,