ja,zh
甜花……頑張りましゅ！,
にへへ……\nバニラも……チョコも……\n美味しい……,
おめでとうございます。ランクアップです\nまたひとつ、夢に近づきましたね！,
プロデューサーさん、シーズン終了です！\nその見事な手腕、来シーズンも見せてくださいね！,
今日は忙しいんですー\nもう帰っていいですかぁ？,
私、何でもフツーにできるんでー\nサボってもいいですかぁ？,
私が急に事務所に\nこなくなったらぁ\nどうしますー？,
ふわぁ……\nやることないと、眠いですねー,
うふふっ、どの子も可愛かったけど……\n今回の合格者は──,
合格の子、素敵だったわよ\nアタシ、気にいっちゃった。どんどん活躍してってね,
いつも通りにやっただけですケド、良かったですー,
おめでとうございます。ランクアップです\nまたひとつ、夢に近づきましたね！,
プロデューサーさん、シーズン終了です！\nその見事な手腕、来シーズンも見せてくださいね！,
今日は休みにしようか\n疲れを取って、また頑張ろう,
それでは発表します\n今回の合格者は──,
合格者の方、おめでとうございます！\n本番まで、しばらくお待ちください,
う～ん、みんなビシッとキマってたが\n今回合格したのは──,
合格した人、おめでとう！\nよかったよ。本番もその調子でやっちゃって！,
お待たせしました。審査が終了しましたので、\n『W.I.N.G.』準決勝の結果発表をさせていただきます,
準決勝合格者の皆さま、おめでとうございます\n次は決勝です。ぜひ、今までで最高の姿を見せてください,
次はぁ、ちょっとだけ本気だしちゃいますねー,
お待たせしました。審査が出そろいましたので、\n『W.I.N.G.』決勝の結果発表をさせていただきます,
優勝者の方、おめでとうございます\nその他の方々は惜しくも敗退です。お疲れさまでした,
もう少し真面目にレッスンすればよかったです……,
プロデュースお疲れ様でした\nこの後は、フェスへ参加してみましょう！,